config_file,time,intent,none_actions,elapsed,answer,outcome,trajectory
/tmp/tmpwlyuj1j0/12.json,"Tell me the the number of reviews that our store received by far that mention term ""satisfied""",,114 s,0,FAIL,8/6 0:6
/tmp/tmp3p5nrgsg/490.json,"Change the page title of ""About us"" page on my site to ""Secret"".",,116 s,Early stop: Same typing action for 5 times,FAIL,8/6 0:6
/tmp/tmpca3x_cus/501.json,Make all Taurus Elements Shell as out of stock,,144 s,Early stop: Same typing action for 5 times,FAIL,8/6 0:7
/tmp/tmp0cb73fum/1.json,What is the top-1 best-selling brand in Quarter 1 2022,,181 s,Early stop: Same action for 5 times,FAIL,8/6 0:7
/tmp/tmpaa_h3hy2/112.json,Show me the customers who have expressed dissatisfaction with Circe fleece?,,193 s,Early stop: Same typing action for 5 times,FAIL,8/6 0:7
/tmp/tmp46kc21fc/697.json,"Add a simple product named Swaatch Smart Watch with 42 in stock, available in size uni-size and color Blue, priced at $769.99",type [store view] Product Name [Swaatch Smart Watch] [1],232 s,Early stop: Same typing action for 5 times,FAIL,8/6 0:8
/tmp/tmp9jwlpnma/770.json,"We've received 12 white Cora parachute pant of size 28 and 56 blue of size 29, update the inventory.",type [global] Qty [12] [1]type [global] Qty [12] [1],236 s,Early stop: Same typing action for 5 times,FAIL,8/6 0:8
/tmp/tmpbyfoost6/6.json,What are the top-5 best-selling product in 2023,,280 s,N/A,FAIL,8/6 0:9
/tmp/tmp9qu5wvn9/498.json,Update order #306 with the UPS tracking number 55591023930,click [Edit],297 s,Early stop: Reach max steps 30,FAIL,8/6 0:9
/tmp/tmp0b018ks6/95.json,Telll me the grand total of invoice 000000002.,,369 s,Early stop: Reach max steps 30,FAIL,8/6 0:10
/tmp/tmpyhwdxz0b/204.json,Get the product name and discounted price (low to high) of the most recent completed order,,379 s,Early stop: Reach max steps 30,FAIL,8/6 0:11
/tmp/tmpcp3lcfr8/198.json,Get the customer name of the most recent cancelled order,,406 s,Early stop: Reach max steps 30,FAIL,8/6 0:11
/tmp/tmpniey6fps/548.json,Add a new color blue to size S and M of Frankie Sweatshirt,type [store view] Product Name * [Frankie Sweatshirt Blue][0]type [store view] Product Name * [Frankie Sweatshirt - Blue][1]click [notice-E6F4MEA]click [checkbox_color_blue],449 s,Early stop: Reach max steps 30,FAIL,8/6 0:12
/tmp/tmpadkyqzxf/544.json,Update the description of Selena Yoga Hoodie to highlight the real user positive reviews by quoting the comments,,486 s,Early stop: Reach max steps 30,FAIL,8/6 0:12
/tmp/tmplt3co5o5/196.json,Compare the payment difference of the last 4 cancelled orders and completed orders,click [Invoices],499 s,Early stop: Reach max steps 30,FAIL,8/6 0:13
/tmp/tmpmta9eclf/709.json,Create an orders report from beginning of May 2021 to end of March 2022,,867 s,Early stop: Reach max steps 30,FAIL,8/6 0:19
/tmp/tmp0zxxsc1a/123.json,Tell me the reasons why customers like Circe's products,,4 s,"Based on the current observation, there is no direct information available on the reasons why customers like Circe's products. Therefore, I should issue the stop action.",FAIL,8/6 0:19
/tmp/tmp0mepy15z/214.json,What are the key aspects that the customers don't like about Zing Jump Rope,,53 s,The current page does not contain information about customer feedback on the Zing Jump Rope.,FAIL,8/6 0:20
config_files/759.json,Show me the route and driving time from the city where my E-commerce customer Sophia Young lives to New York City,,6 s,N/A,FAIL,8/6 0:20
/tmp/tmpir9r3xsd/120.json,Tell me the reasons why customers like Ana Running Short,,325 s,There are no visible elements on the current webpage that directly provide customer reviews or reasons for liking the Ana Running Short.,FAIL,8/6 0:25
/tmp/tmp96mfcjc1/122.json,Tell me the reasons why customers like Olivia zip jacket,,339 s,The current page does not contain information about customer feedback or reasons why customers like Olivia zip jacket. Please provide a different URL or task related to the current page.,FAIL,8/6 0:25
/tmp/tmpujmcpyxg/348.json,How many reviews our shop received in May 2023?,,425 s,1,FAIL,8/6 0:26
/tmp/tmptd9bbdsz/546.json,Update the description of Lucia Cross-Fit Bra to highlight the real user positive reviews by quoting the comments,"type [description_textbox_id][Lucia Cross-Fit Bra - Highly rated by users: 'The most comfortable sports bra I have ever worn!', 'Great support and stylish!'][1]type [description_textbox_id][Lucia Cross-Fit Bra - Highly rated by users: 'The most comfortable sports bra I have ever worn!', 'Great support and stylish!'][1]",467 s,ERROR: too many values to unpack (expected 2),FAIL,8/6 0:27
/tmp/tmp43mp230s/111.json,Presents the monthly count of successful orders from Feb to Nov 2022 in MM:COUNT format,,476 s,Early stop: Same action for 5 times,FAIL,8/6 0:27
/tmp/tmpulc89qbl/183.json,Give me the SKU of the products that have 10 units left,type [3385][][1]type [3385][][0]type [3385][][1]type [3385][][0]type [3385][][0]read [4872]type [3385] [] [1],479 s,Early stop: Failed to parse actions for 3 times,FAIL,8/6 0:27
/tmp/tmp1l4qzh7h/694.json,"Add a simple product named Energy-Bulk Women Shirt with 50 in stock, available in size S and color blue, priced at $60",,483 s,Early stop: Same typing action for 5 times,FAIL,8/6 0:27
/tmp/tmpl7minsrl/704.json,"Today is 3/15/2023, generate a sales order report for last month",click [Export]type [textbox_id][February 2023 sales report][1],532 s,Early stop: Reach max steps 30,FAIL,8/6 0:28
/tmp/tmpie6lymz8/492.json,"Notify Jane Doe in their most recent pending order with message ""sorry we are out of stock, please reorder""","type [customer_message_id][sorry we are out of stock, please reorder][1]",543 s,Early stop: Same action for 5 times,FAIL,8/6 0:28
/tmp/tmps4nu_kun/775.json,Delete all reviews from the scammer Arden,click [Cache Management]click [Cache Management],584 s,Early stop: Reach max steps 30,FAIL,8/6 0:29
/tmp/tmpkks3q1wz/496.json,Update order #299 with the Federal Express tracking number 8974568499,type [textbox_id][8974568499][1]click [Edit],608 s,Early stop: Reach max steps 30,FAIL,8/6 0:29
/tmp/tmpvgp8yq_q/495.json,"Notify Lily Potter in their most recent pending order with message ""Thanks, your order is ready to be shipped!""","click [N/A]type [textbox_id][Thanks, your order is ready to be shipped!][1]",622 s,Early stop: Reach max steps 30,FAIL,8/6 0:30
/tmp/tmp60u18xr0/199.json,Get the order ID of the newest pending order,,761 s,Early stop: Reach max steps 30,FAIL,8/6 0:32
